{
  "schema_version": "1.2",
  "schema_url": "https://edgecardhq.com/schemas/partner-feed-v1-2.json",
  "product": "Edge Card",
  "track": "SAR",
  "track_name": "Saratoga",
  "date": "2026-07-30",
  "model_version": "v0-heuristic-1.4+cfg.aab788cb@code.d51a4d10",
  "generated_ts_utc": "2026-07-30T15:34:41+00:00",
  "first_post_et": "1:10 PM ET",
  "n_races": 9,
  "n_flags": 0,
  "n_passes": 9,
  "edge_of_day": null,
  "url": "https://edgecardhq.com/archive/2026-07-30-sar/",
  "record_url": "https://edgecardhq.com/record",
  "methodology_url": "https://edgecardhq.com/methodology",
  "partner_links": {
    "source": "twinspires",
    "record_url": "https://edgecardhq.com/record?utm_source=twinspires",
    "methodology_url": "https://edgecardhq.com/methodology?utm_source=twinspires",
    "card_url": "https://edgecardhq.com/archive/2026-07-30-sar/?utm_source=twinspires",
    "note": "Use these in place of the untagged URLs above. The single utm_source parameter lets us count traffic from this placement in our own analytics; we add no other parameters, set no cookies, and do not attempt to identify individual readers."
  },
  "attribution": "Powered by Brisnet data. Analysis, not wagering advice. 18+/21+ (where required). 1-800-GAMBLER.",
  "record": null,
  "flags": [],
  "errata": [],
  "scratch_status": {
    "state": "CHECKED_WITH_CHANGES",
    "confirmed": true,
    "message": "Scratch status checked at 11:34 AM ET. Late scratches void at scoring; the card is never edited.",
    "late_scratch_rule": "Late scratches void at scoring; the card is never edited.",
    "checked_at_utc": "2026-07-30T15:34:00+00:00",
    "checked_at_et": "11:34 AM ET",
    "source": "https://tr-cdn.nyra.com/direct/scratches/SARscratch.html"
  },
  "parlays": [],
  "card_reads": [
    {
      "race": 1,
      "tier": "off",
      "top": null,
      "read": "PASS - WET-DIRT CONDITIONS NOT YET VALIDATED. NYRA reports the main track SLOPPY (rain, 64F). The frozen public model carries no track-condition input and was not fit on off going, so it is not validated here.",
      "read_plain": "Passing this one on the going. The model was built and tested on dry dirt, and it has never been shown to price a wet track properly — so on a sloppy or muddy strip we do not have a number we trust. That is a limit of the model, not a read on the race.",
      "coverage_set": [],
      "edge_pts": null
    },
    {
      "race": 2,
      "tier": "off",
      "top": null,
      "read": "PASS - SURFACE SWITCH AND FIELD RECONSTRUCTION OUTSIDE CURRENT VALIDATED SCOPE. NYRA moved this race off the turf; the entered population was assembled for turf and the field is materially reconstructed.",
      "read_plain": "This race came off the turf. The field was assembled for grass, and once a race is moved the shape of it changes — different horses scratch, different runners are suited. Our number was built for the race that was entered, not the one now being run, so we sit it out.",
      "coverage_set": [],
      "edge_pts": null
    },
    {
      "race": 3,
      "tier": "off",
      "top": null,
      "read": "PASS - WET-DIRT CONDITIONS NOT YET VALIDATED. NYRA reports the main track SLOPPY (rain, 64F). The frozen public model carries no track-condition input and was not fit on off going, so it is not validated here.",
      "read_plain": "Passing this one on the going. The model was built and tested on dry dirt, and it has never been shown to price a wet track properly — so on a sloppy or muddy strip we do not have a number we trust. That is a limit of the model, not a read on the race.",
      "coverage_set": [],
      "edge_pts": null
    },
    {
      "race": 4,
      "tier": "off",
      "top": null,
      "read": "PASS - WET-DIRT CONDITIONS NOT YET VALIDATED. NYRA reports the main track SLOPPY (rain, 64F). The frozen public model carries no track-condition input and was not fit on off going, so it is not validated here.",
      "read_plain": "Passing this one on the going. The model was built and tested on dry dirt, and it has never been shown to price a wet track properly — so on a sloppy or muddy strip we do not have a number we trust. That is a limit of the model, not a read on the race.",
      "coverage_set": [],
      "edge_pts": null
    },
    {
      "race": 5,
      "tier": "off",
      "top": null,
      "read": "PASS - SURFACE SWITCH AND FIELD RECONSTRUCTION OUTSIDE CURRENT VALIDATED SCOPE. NYRA moved this race off the turf; the entered population was assembled for turf and the field is materially reconstructed.",
      "read_plain": "This race came off the turf. The field was assembled for grass, and once a race is moved the shape of it changes — different horses scratch, different runners are suited. Our number was built for the race that was entered, not the one now being run, so we sit it out.",
      "coverage_set": [],
      "edge_pts": null
    },
    {
      "race": 6,
      "tier": "off",
      "top": null,
      "read": "PASS - WET-DIRT CONDITIONS NOT YET VALIDATED. NYRA reports the main track SLOPPY (rain, 64F). The frozen public model carries no track-condition input and was not fit on off going, so it is not validated here.",
      "read_plain": "Passing this one on the going. The model was built and tested on dry dirt, and it has never been shown to price a wet track properly — so on a sloppy or muddy strip we do not have a number we trust. That is a limit of the model, not a read on the race.",
      "coverage_set": [],
      "edge_pts": null
    },
    {
      "race": 7,
      "tier": "off",
      "top": null,
      "read": "PASS - WET-DIRT CONDITIONS NOT YET VALIDATED. NYRA reports the main track SLOPPY (rain, 64F). The frozen public model carries no track-condition input and was not fit on off going, so it is not validated here.",
      "read_plain": "Passing this one on the going. The model was built and tested on dry dirt, and it has never been shown to price a wet track properly — so on a sloppy or muddy strip we do not have a number we trust. That is a limit of the model, not a read on the race.",
      "coverage_set": [],
      "edge_pts": null
    },
    {
      "race": 8,
      "tier": "off",
      "top": null,
      "read": "RACE CANCELLED - NYRA daily notes: race 8 is cancelled. No selections, no analysis.",
      "read_plain": "This race did not run.",
      "coverage_set": [],
      "edge_pts": null
    },
    {
      "race": 9,
      "tier": "off",
      "top": null,
      "read": "PASS - SURFACE SWITCH AND FIELD RECONSTRUCTION OUTSIDE CURRENT VALIDATED SCOPE. NYRA moved this race off the turf; the entered population was assembled for turf and the field is materially reconstructed.",
      "read_plain": "This race came off the turf. The field was assembled for grass, and once a race is moved the shape of it changes — different horses scratch, different runners are suited. Our number was built for the race that was entered, not the one now being run, so we sit it out.",
      "coverage_set": [],
      "edge_pts": null
    }
  ],
  "multi_race": []
}
